{"artifact":"LOCUS-compose-profile-evidence-v1","metadata":{"configuration":{"block":6,"orchestration_seed":2026072306,"scenario":"enroll-recover-success-v1","scenario_position":3,"topology":"same-host-compose-5-party-v1"},"evidence_class":"paper","experiment_id":"compose-performance-v1","finished_at":"2026-07-23T14:07:04.446678+00:00","git":{"commit":"812cb96cc5fba9d4332ae349eb6d664bac0f17b1","dirty":false},"host":{"id":"cycle1-host-a","machine":"AMD64","processor":"Intel64 Family 6 Model 154 Stepping 3, GenuineIntel","python":"3.12.13 (main, Jun 23 2026, 15:23:43) [MSC v.1944 64 bit (AMD64)]","release":"11","system":"Windows"},"locks":{"tpass-core/Cargo.lock":"82919089467402e99760719fac9631cc0722f8b6935b599608d42bbd5c0984bb","tpass-python/Cargo.lock":"9865d4c03fc7fa8a807abdc612499dc50b3a833f2aa433027a8fd390d5b849fc","uv.lock":"4fbd85bc3c1c96cd95929e645294b44b521023f3329fdd00d13466c29ee0f29c"},"profile":"compose-performance","randomness":{"kind":"orchestrator-prng-v1","seed":2026072306},"raw_output":{"path":"experiments/raw/performance-v1/06/enroll-recover-success-v1.json","retained":true},"started_at":"2026-07-23T14:06:29.388624+00:00","version":"LOCUS-experiment-metadata-v1","warnings":[]},"result":{"artifact":"LOCUS-compose-performance-result-v1","block":6,"cleanup":"passed","configuration":{"alternate_selected":[2,3],"authorization_membership":5,"authorization_quorum":4,"baseline_selected":[1,3],"measurements":3,"threshold":2,"topology":"same-host-compose-5-party-v1","tpass_parties":3,"warmups":1},"enrollment_latency_ms":208.54346499982057,"orchestration_latency_ms":35056.05710018426,"orchestration_seed":2026072306,"output_scan":"passed","profile":"performance","runtime":{"compose_version":"5.3.0","docker_engine_version":"29.6.1","reference_image_id":"sha256:d5880a07705c983ee12c9c0e51002b081ba1b558a78d7f79910882e174da41ad","s3_image":"chrislusf/seaweedfs:4.29@sha256:d47c7ee99fcb951351d7194915f4e3a5ea604a8e8871183d713907dec4fb9bf5"},"samples":[{"application_bytes":{"authorization":{"received":9540,"sent":33790},"cloud":{"received":1013,"sent":0},"resolver":{"received":387,"sent":0},"tpass":{"received":1226,"sent":8766}},"artifact":"LOCUS-performance-client-samples-v1","attempts":{"after":2,"before":1},"latency_ms":{"authorization":179.82426600065082,"client_setup":6.1712589995295275,"cloud":223.0538859985245,"commitment":97.28121100124554,"finalization":1.7390760003763717,"resolver":19.160982003086247,"response":28.48312200148939,"status_check":14.634068000304978,"total":570.8322139980737,"unclassified":0.4843439928663429},"measurement":1,"outcome":"success","selected":[1,3],"status":"ok"},{"application_bytes":{"authorization":{"received":9540,"sent":33790},"cloud":{"received":1013,"sent":0},"resolver":{"received":387,"sent":0},"tpass":{"received":1226,"sent":8766}},"artifact":"LOCUS-performance-client-samples-v1","attempts":{"after":3,"before":2},"latency_ms":{"authorization":217.86653299932368,"client_setup":8.220081999752438,"cloud":9.348403997137211,"commitment":161.15254699980142,"finalization":1.3016240009164903,"resolver":1.476422003179323,"response":22.792227999161696,"status_check":18.039047998172464,"total":440.5913119990146,"unclassified":0.3944240015698597},"measurement":2,"outcome":"success","selected":[1,3],"status":"ok"},{"application_bytes":{"authorization":{"received":9540,"sent":33790},"cloud":{"received":1013,"sent":0},"resolver":{"received":387,"sent":0},"tpass":{"received":1226,"sent":8766}},"artifact":"LOCUS-performance-client-samples-v1","attempts":{"after":4,"before":3},"latency_ms":{"authorization":176.68955599947367,"client_setup":7.070605002809316,"cloud":10.66077199720894,"commitment":106.54868499841541,"finalization":1.5912150010990445,"resolver":1.7024689987010788,"response":36.213949002558365,"status_check":9.375691999593982,"total":350.5473479999637,"unclassified":0.6944050001038704},"measurement":3,"outcome":"success","selected":[1,3],"status":"ok"}],"scenario_id":"enroll-recover-success-v1","scenario_position":3,"status":"ok","storage":{"after":{"artifact":"LOCUS-storage-metric-v1","client_bytes":3400,"party_bytes":[1289832,1063232,1289832,1062081,1062081],"status":"ok"},"before":{"artifact":"LOCUS-storage-metric-v1","client_bytes":3400,"party_bytes":[268072,268072,268072,266921,266921],"status":"ok"},"cloud_object_bytes":1013}},"trace_policy":{"core_dump_policy":"disabled-by-container-ulimit","network_trace_policy":"not-collected","retained_content":"aggregate-result-and-provenance-only","service_log_policy":"scanned-then-discarded","version":"LOCUS-profile-trace-policy-v1"}}
