{"artifact":"LOCUS-compose-profile-evidence-v1","metadata":{"configuration":{"scenario":"cloud-snapshot-no-offline-predicate-v1","topology":"same-host-compose-5-party-v1"},"evidence_class":"paper","experiment_id":"compose-attack","finished_at":"2026-07-23T13:51:03.418832+00:00","git":{"commit":"812cb96cc5fba9d4332ae349eb6d664bac0f17b1","dirty":false},"host":{"id":"cycle1-host-a","machine":"AMD64","processor":"Intel64 Family 6 Model 154 Stepping 3, GenuineIntel","python":"3.12.13 (main, Jun 23 2026, 15:23:43) [MSC v.1944 64 bit (AMD64)]","release":"11","system":"Windows"},"locks":{"tpass-core/Cargo.lock":"82919089467402e99760719fac9631cc0722f8b6935b599608d42bbd5c0984bb","tpass-python/Cargo.lock":"9865d4c03fc7fa8a807abdc612499dc50b3a833f2aa433027a8fd390d5b849fc","uv.lock":"4fbd85bc3c1c96cd95929e645294b44b521023f3329fdd00d13466c29ee0f29c"},"profile":"compose-attack","randomness":{"kind":"os-csprng","seed":null},"raw_output":{"path":"experiments/raw/attacks-v1/cloud-snapshot-no-offline-predicate-v1.json","retained":true},"started_at":"2026-07-23T13:50:16.099382+00:00","version":"LOCUS-experiment-metadata-v1","warnings":[]},"result":{"expected_result":{"candidate_count":2,"candidate_signals":0,"excluded_path_accesses":0,"network_attempts":0,"prohibited_material":"absent","snapshot_validation":"passed"},"interpretation":"The exact current S3-compatible cloud snapshot and the registered offline candidate path exposed no local candidate-correctness predicate or prohibited role material. This is implementation evidence for this bounded surface, not a cryptographic proof, real-provider forensic result, or statement about cue strength.","observed_result":{"candidate_count":2,"candidate_signals":0,"excluded_path_accesses":0,"network_attempts":0,"prohibited_material":"absent","snapshot_validation":"passed"},"parameters":{"candidate_count":2,"execution_boundary":"network-none-read-only-snapshot-v1","snapshot_version":"LOCUS-cloud-snapshot-input-v1"},"prerequisites":["one canonical synthetic backup published through the S3-compatible adapter","exact two-file cloud-only snapshot with no client or party state","network-disabled runner with a read-only snapshot mount"],"procedure":["validate the canonical object, manifest, locator, digest, size, and TPASS public metadata","reject excluded files, prohibited fields, malformed input, and object substitution","exercise two fixed synthetic attacker candidates under filesystem and network guards","emit only aggregate boundary counts through the versioned attack-report contract"],"profile":"attack","scenario_id":"cloud-snapshot-no-offline-predicate-v1","status":"passed","version":"LOCUS-attack-report-v1"},"trace_policy":{"core_dump_policy":"disabled-by-container-ulimit","network_trace_policy":"not-collected","retained_content":"aggregate-result-and-provenance-only","service_log_policy":"scanned-then-discarded","version":"LOCUS-profile-trace-policy-v1"}}
