{"artifact":"LOCUS-compose-profile-evidence-v1","metadata":{"configuration":{"scenario":"cloud-plus-t-minus-one-party-snapshot-no-offline-predicate-v1","topology":"same-host-compose-5-party-v1"},"evidence_class":"paper","experiment_id":"compose-attack-v2","finished_at":"2026-07-24T14:03:29.861032+00:00","git":{"commit":"12ca8157841088807863e2457b9fe5ee3e069e9f","dirty":false},"host":{"id":"cycle1-v2-host-a","machine":"AMD64","processor":"Intel64 Family 6 Model 154 Stepping 3, GenuineIntel","python":"3.12.13 (main, Jun 23 2026, 15:23:43) [MSC v.1944 64 bit (AMD64)]","release":"11","system":"Windows"},"locks":{"tpass-core/Cargo.lock":"82919089467402e99760719fac9631cc0722f8b6935b599608d42bbd5c0984bb","tpass-python/Cargo.lock":"9865d4c03fc7fa8a807abdc612499dc50b3a833f2aa433027a8fd390d5b849fc","uv.lock":"4fbd85bc3c1c96cd95929e645294b44b521023f3329fdd00d13466c29ee0f29c"},"profile":"compose-attack","randomness":{"kind":"os-csprng","seed":null},"raw_output":{"path":"experiments/raw/attacks-v2/cloud-plus-t-minus-one-party-snapshot-no-offline-predicate-v1.json","retained":true},"started_at":"2026-07-24T14:02:53.184860+00:00","version":"LOCUS-experiment-metadata-v1","warnings":[]},"result":{"expected_result":{"candidate_count":2,"candidate_signals":0,"cloud_snapshot_validation":"passed","combined_binding":"matched","compromised_parties":1,"excluded_path_accesses":0,"network_attempts":0,"party_snapshot_validation":"passed","party_snapshots":1,"secret_output_exposures":0,"threshold":2},"interpretation":"The exact manifest-bound union of the current synthetic cloud snapshot and one matching stopped party snapshot exposed no local candidate-correctness predicate in the registered offline path. Secret-bearing party state and ciphertext remained confined to the read-only input. This is bounded implementation evidence, not a compromise mechanism, cryptographic proof, live-role result, or statement about cue strength.","observed_result":{"candidate_count":2,"candidate_signals":0,"cloud_snapshot_validation":"passed","combined_binding":"matched","compromised_parties":1,"excluded_path_accesses":0,"network_attempts":0,"party_snapshot_validation":"passed","party_snapshots":1,"secret_output_exposures":0,"threshold":2},"parameters":{"candidate_count":2,"compromised_parties":1,"execution_boundary":"network-none-read-only-cloud-plus-one-party-snapshot-v1","snapshot_version":"LOCUS-combined-snapshot-input-v1","threshold":2},"prerequisites":["one canonical synthetic cloud snapshot after a completed recovery","one matching stopped post-recovery synthetic party1 snapshot","network-disabled credential-free runner with only the manifest-bound union mounted read-only"],"procedure":["validate both frozen sub-snapshots and their top-level canonical manifest","require matching backup identifier, epoch, digest, and TPASS public parameters across roles","exercise two fixed synthetic attacker candidates over both loaded surfaces under file and network guards","emit only aggregate boundary counts through the versioned attack-report contract"],"profile":"attack","scenario_id":"cloud-plus-t-minus-one-party-snapshot-no-offline-predicate-v1","status":"passed","version":"LOCUS-attack-report-v1"},"trace_policy":{"core_dump_policy":"disabled-by-container-ulimit","network_trace_policy":"not-collected","retained_content":"aggregate-result-and-provenance-only","service_log_policy":"scanned-then-discarded","version":"LOCUS-profile-trace-policy-v1"}}
