{"artifact":"LOCUS-compose-profile-evidence-v1","metadata":{"configuration":{"scenario":"t-minus-one-party-snapshot-no-offline-predicate-v1","topology":"same-host-compose-5-party-v1"},"evidence_class":"paper","experiment_id":"compose-attack","finished_at":"2026-07-23T13:51:42.971681+00:00","git":{"commit":"812cb96cc5fba9d4332ae349eb6d664bac0f17b1","dirty":false},"host":{"id":"cycle1-host-a","machine":"AMD64","processor":"Intel64 Family 6 Model 154 Stepping 3, GenuineIntel","python":"3.12.13 (main, Jun 23 2026, 15:23:43) [MSC v.1944 64 bit (AMD64)]","release":"11","system":"Windows"},"locks":{"tpass-core/Cargo.lock":"82919089467402e99760719fac9631cc0722f8b6935b599608d42bbd5c0984bb","tpass-python/Cargo.lock":"9865d4c03fc7fa8a807abdc612499dc50b3a833f2aa433027a8fd390d5b849fc","uv.lock":"4fbd85bc3c1c96cd95929e645294b44b521023f3329fdd00d13466c29ee0f29c"},"profile":"compose-attack","randomness":{"kind":"os-csprng","seed":null},"raw_output":{"path":"experiments/raw/attacks-v1/t-minus-one-party-snapshot-no-offline-predicate-v1.json","retained":true},"started_at":"2026-07-23T13:51:12.944783+00:00","version":"LOCUS-experiment-metadata-v1","warnings":[]},"result":{"expected_result":{"candidate_count":2,"candidate_signals":0,"cloud_material":"absent","compromised_parties":1,"excluded_path_accesses":0,"network_attempts":0,"secret_output_exposures":0,"snapshot_validation":"passed","threshold":2},"interpretation":"The complete stopped persistent snapshot of one synthetic party in the deployed two-of-three TPASS profile and the registered offline candidate path exposed no local candidate-correctness predicate. Secret-bearing party state remained confined to the read-only input. This is bounded implementation evidence, not a compromise mechanism, cryptographic proof, live-party result, or statement about cue strength.","observed_result":{"candidate_count":2,"candidate_signals":0,"cloud_material":"absent","compromised_parties":1,"excluded_path_accesses":0,"network_attempts":0,"secret_output_exposures":0,"snapshot_validation":"passed","threshold":2},"parameters":{"candidate_count":2,"compromised_parties":1,"execution_boundary":"network-none-read-only-one-party-snapshot-v1","snapshot_version":"LOCUS-party-snapshot-input-v1","threshold":2},"prerequisites":["one stopped post-recovery synthetic party1 persistent volume","exact one-party snapshot with no cloud, client, resolver, or other-party state","network-disabled credential-free runner with a read-only snapshot mount"],"procedure":["validate the canonical manifest and every persistent file in the stopped party volume","validate the one-party authorizer, TLS, native TPASS, and SQLite checkpoint bindings","exercise two fixed synthetic attacker candidates under filesystem and network guards","emit only aggregate boundary counts through the versioned attack-report contract"],"profile":"attack","scenario_id":"t-minus-one-party-snapshot-no-offline-predicate-v1","status":"passed","version":"LOCUS-attack-report-v1"},"trace_policy":{"core_dump_policy":"disabled-by-container-ulimit","network_trace_policy":"not-collected","retained_content":"aggregate-result-and-provenance-only","service_log_policy":"scanned-then-discarded","version":"LOCUS-profile-trace-policy-v1"}}
